{
  "id": "d76b0a8e-7375-4ff8-8540-0377de77d360",
  "title": "2025 Tempe High School Mathematics Extension 1 Assessment Task 3",
  "author_id": "1",
  "subject": "Mathematics Extension 1",
  "visibility": "private",
  "question_count": 12,
  "total_marks": 38,
  "duration_minutes": 45,
  "created_at": "2026-06-16T02:44:43.568005Z",
  "updated_at": "2026-06-16T02:44:43.568005Z",
  "questions": [
    {
      "id": "bf42b9f8-e801-4a73-90f0-7584b608f808",
      "paper_id": "d76b0a8e-7375-4ff8-8540-0377de77d360",
      "author_id": "1",
      "number": 1,
      "type": "short_answer",
      "marks": 2,
      "stimulus": [
        {
          "kind": "image",
          "url": "IMAGE_PLACEHOLDER_1",
          "mime_type": "image/png"
        }
      ],
      "content": [
        {
          "kind": "text",
          "text": "Sketch the gradient segments for the differential equation $y' = \\frac{x^2}{y^2}$ at the points (1,3), (-2,2), (4,-1), and (0,-2) on the grid below."
        }
      ],
      "parts": null,
      "options": null,
      "answer": {
        "option_label": null,
        "summary": "Gradient segments at (1,3): 1/9, (-2,2): 1, (4,-1): 16, (0,-2): 0",
        "content": [
          {
            "kind": "text",
            "text": "Calculate $y' = \\frac{x^2}{y^2}$ for each point: (1,3): $1/9$, (-2,2): $1$, (4,-1): $16$, (0,-2): $0$. Sketch these slopes at the respective points."
          }
        ],
        "alternatives": null
      },
      "difficulty": null,
      "topics": ["Differential Equations"],
      "syllabus_points": [],
      "outcomes": [],
      "rubric": null,
      "guidelines": null,
      "created_at": "2026-06-16T02:44:43.568005Z",
      "updated_at": "2026-06-16T02:44:43.568005Z",
      "source_paper_id": null,
      "source_question_id": null,
      "source_removed": false,
      "remixed_from": null
    },
    {
      "id": "c943875f-fc1f-47ff-9d50-94550f6a7e69",
      "paper_id": "d76b0a8e-7375-4ff8-8540-0377de77d360",
      "author_id": "1",
      "number": 2,
      "type": "short_answer",
      "marks": 2,
      "stimulus": null,
      "content": [
        {
          "kind": "text",
          "text": "Solve the differential equation $\\frac{dy}{dx} = 2y + 5$, given that $y(-2) = 3$. Express your solution as a function of $x$."
        }
      ],
      "parts": null,
      "options": null,
      "answer": {
        "option_label": null,
        "summary": "$y = -\\frac{5}{2} + \\frac{11}{2}e^{2(x+2)}$",
        "content": [
          {
            "kind": "text",
            "text": "Separate variables: $\\frac{dy}{2y+5} = dx$. Integrate: $\\frac{1}{2}\\ln|2y+5| = x + C$. Use initial condition to find $C = \\ln\\left(\\frac{11}{2}\\right) - 2$. Solve for $y$ to get $y = -\\frac{5}{2} + \\frac{11}{2}e^{2(x+2)}$."
          }
        ],
        "alternatives": null
      },
      "difficulty": null,
      "topics": ["Differential Equations"],
      "syllabus_points": [],
      "outcomes": [],
      "rubric": null,
      "guidelines": null,
      "created_at": "2026-06-16T02:44:43.568005Z",
      "updated_at": "2026-06-16T02:44:43.568005Z",
      "source_paper_id": null,
      "source_question_id": null,
      "source_removed": false,
      "remixed_from": null
    },
    {
      "id": "d0e1f2a3-b4c5-46d7-e8f9-a0b1c2d3e4f5",
      "paper_id": "d76b0a8e-7375-4ff8-8540-0377de77d360",
      "author_id": "1",
      "number": 3,
      "type": "long_answer",
      "marks": 6,
      "stimulus": [
        {
          "kind": "text",
          "text": "The rate of growth of the population of fish in a pond can be described by the differential equation $\\frac{dp}{dt} = 0.2p\\left(\\frac{P - p}{P}\\right)$ where $t$ is the time in months, $p$ is the current population and $P$ is the carrying capacity of the pond."
        }
      ],
      "content": null,
      "parts": [
        {
          "label": "a",
          "stimulus": null,
          "content": [
            {
              "kind": "text",
              "text": "Show that $\\frac{P}{p(P - p)} = \\frac{1}{p} + \\frac{1}{P - p}$."
            }
          ],
          "marks": 1,
          "is_independent": true,
          "answer": {
            "option_label": null,
            "summary": "$\\frac{P}{p(P - p)} = \\frac{1}{p} + \\frac{1}{P - p}$",
            "content": [
              {
                "kind": "text",
                "text": "Partial fractions: $\\frac{P}{p(P - p)} = P\\left(\\frac{A}{p} + \\frac{B}{P - p}\\right)$. Solve for $A$ and $B$ to get $A = \\frac{1}{P}$ and $B = \\frac{1}{P}$. Thus, $\\frac{P}{p(P - p)} = \\frac{1}{p} + \\frac{1}{P - p}$."
              }
            ],
            "alternatives": null
          }
        },
        {
          "label": "b",
          "stimulus": null,
          "content": [
            {
              "kind": "text",
              "text": "Hence solve the differential equation, given that there were 100 fish in the pond at the start."
            }
          ],
          "marks": 3,
          "is_independent": false,
          "answer": {
            "option_label": null,
            "summary": "$p = \\frac{P}{1 + 4e^{-0.2Pt}}$",
            "content": [
              {
                "kind": "text",
                "text": "Separate variables and integrate using the result from part (a). Use initial condition $p(0) = 100$ to find the constant. The solution is $p = \\frac{P}{1 + 4e^{-0.2Pt}}$."
              }
            ],
            "alternatives": null
          }
        },
        {
          "label": "c",
          "stimulus": null,
          "content": [
            {
              "kind": "text",
              "text": "Given that the population of the fish grew to 250 after 5 months, what is the carrying capacity of the pond?"
            }
          ],
          "marks": 2,
          "is_independent": false,
          "answer": {
            "option_label": null,
            "summary": "$P = 500$",
            "content": [
              {
                "kind": "text",
                "text": "Substitute $p(5) = 250$ into the solution from part (b). Solve for $P$ to get $P = 500$."
              }
            ],
            "alternatives": null
          }
        }
      ],
      "options": null,
      "answer": null,
      "difficulty": null,
      "topics": ["Differential Equations"],
      "syllabus_points": [],
      "outcomes": [],
      "rubric": null,
      "guidelines": null,
      "created_at": "2026-06-16T02:44:43.568005Z",
      "updated_at": "2026-06-16T02:44:43.568005Z",
      "source_paper_id": null,
      "source_question_id": null,
      "source_removed": false,
      "remixed_from": null
    },
    {
      "id": "e1f2a3b4-c5d6-47e8-f9a0-b1c2d3e4f5a6",
      "paper_id": "d76b0a8e-7375-4ff8-8540-0377de77d360",
      "author_id": "1",
      "number": 4,
      "type": "short_answer",
      "marks": 3,
      "stimulus": null,
      "content": [
        {
          "kind": "text",
          "text": "Find the particular solution to the differential equation $(e^{x}+1)\\frac{dy}{dx}=e^{x}\\sec y$ that passes through the origin."
        }
      ],
      "parts": null,
      "options": null,
      "answer": {
        "option_label": null,
        "summary": "$y = \\sin^{-1}\\left(\\frac{e^x}{e^x + 1}\\right)$",
        "content": [
          {
            "kind": "text",
            "text": "Separate variables: $\\cos y \\, dy = \\frac{e^x}{e^x + 1} \\, dx$. Integrate: $\\sin y = \\ln(e^x + 1) + C$. Use initial condition $y(0) = 0$ to find $C = 0$. Thus, $y = \\sin^{-1}\\left(\\frac{e^x}{e^x + 1}\\right)$."
          }
        ],
        "alternatives": null
      },
      "difficulty": null,
      "topics": ["Differential Equations"],
      "syllabus_points": [],
      "outcomes": [],
      "rubric": null,
      "guidelines": null,
      "created_at": "2026-06-16T02:44:43.568005Z",
      "updated_at": "2026-06-16T02:44:43.568005Z",
      "source_paper_id": null,
      "source_question_id": null,
      "source_removed": false,
      "remixed_from": null
    },
    {
      "id": "f2a3b4c5-d6e7-48f9-a0b1-c2d3e4f5a6b7",
      "paper_id": "d76b0a8e-7375-4ff8-8540-0377de77d360",
      "author_id": "1",
      "number": 5,
      "type": "short_answer",
      "marks": 2,
      "stimulus": null,
      "content": [
        {
          "kind": "text",
          "text": "Find $\\int \\sin^2 4x \\, dx$."
        }
      ],
      "parts": null,
      "options": null,
      "answer": {
        "option_label": null,
        "summary": "$\\frac{x}{2} - \\frac{\\sin 8x}{16} + C$",
        "content": [
          {
            "kind": "text",
            "text": "Use identity $\\sin^2 A = \\frac{1 - \\cos 2A}{2}$. Thus, $\\int \\sin^2 4x \\, dx = \\int \\frac{1 - \\cos 8x}{2} \\, dx = \\frac{x}{2} - \\frac{\\sin 8x}{16} + C$."
          }
        ],
        "alternatives": null
      },
      "difficulty": null,
      "topics": ["Further Trigonometry"],
      "syllabus_points": [],
      "outcomes": [],
      "rubric": null,
      "guidelines": null,
      "created_at": "2026-06-16T02:44:43.568005Z",
      "updated_at": "2026-06-16T02:44:43.568005Z",
      "source_paper_id": null,
      "source_question_id": null,
      "source_removed": false,
      "remixed_from": null
    },
    {
      "id": "a3b4c5d6-e7f8-49a0-b1c2-d3e4f5a6b7c8",
      "paper_id": "d76b0a8e-7375-4ff8-8540-0377de77d360",
      "author_id": "1",
      "number": 6,
      "type": "short_answer",
      "marks": 2,
      "stimulus": null,
      "content": [
        {
          "kind": "text",
          "text": "Differentiate $y = \\tan^{-1} \\sqrt{x}$."
        }
      ],
      "parts": null,
      "options": null,
      "answer": {
        "option_label": null,
        "summary": "$\\frac{1}{2\\sqrt{x}(1 + x)}$",
        "content": [
          {
            "kind": "text",